{
  "$schema": "../schema/flow.schema.json",
  "version": 1,
  "id": "estimation",
  "title": { "th": "กระบวนการประเมินราคา", "en": "Estimation workflow" },
  "description": { "th": "จาก Draft ผ่านการคำนวณและ Approval Route ที่ตรึงไว้จนออกใบเสนอราคา", "en": "From draft through reproducible calculation and a frozen approval route to quotation." },
  "document": "../01-business/estimation-flow.md",
  "illustration": { "src": "assets/estimate.svg", "alt": { "th": "ภาพเครื่องคิดเลข รายการวัสดุ และแบบงาน", "en": "Calculator, material list and plan illustration" } },
  "groups": [
    { "id": "input", "label": { "th": "ข้อมูลนำเข้า", "en": "Inputs" } },
    { "id": "calculation", "label": { "th": "คำนวณ", "en": "Calculation" } },
    { "id": "governance", "label": { "th": "ควบคุม", "en": "Governance" } }
  ],
  "nodes": [
    { "id": "survey-ready", "group": "input", "order": 1, "title": { "th": "ข้อมูลสำรวจพร้อม", "en": "Survey Ready" }, "summary": { "th": "ขนาด รูปถ่าย ขอบเขต และสมมติฐานครบขั้นต่ำ", "en": "Dimensions, photos, scope and assumptions meet the minimum." }, "icon": "survey", "phase": "phase-2", "status": "draft", "document": "../01-business/estimation-flow.md" },
    { "id": "scope-work", "group": "input", "order": 2, "title": { "th": "จัดหมวดงาน", "en": "Structure Work" }, "summary": { "th": "แยกหมวดและ Work Item; ผูก Item Master หรือบันทึกเหตุผลรายการงานกำหนดเอง", "en": "Organize work items; link an Item Master record or document a custom work item reason." }, "icon": "project", "phase": "phase-2", "status": "draft", "document": "../01-business/estimation-flow.md", "details": [{ "th": "Work Item ที่ไม่มี Item Master ต้องมีรหัสและหมายเหตุเหตุผล และจะถูกส่งเป็น Approval Trigger", "en": "A work item without an Item Master link requires a reason code and note and creates an approval trigger." }] },
    { "id": "cost", "group": "calculation", "order": 3, "title": { "th": "จัดต้นทุน", "en": "Build Cost" }, "summary": { "th": "เลือก Item ที่เปิดใช้ในสาขาจาก Catalog พร้อมต้นทุนที่มีรุ่น หรือระบุเหตุผลต้นทุนชั่วคราว", "en": "Select branch-available catalog items with versioned costs, or provide a provisional-cost reason." }, "icon": "estimate", "phase": "phase-2", "status": "accepted", "document": "../01-business/item-master-flow.md" },
    { "id": "price", "group": "calculation", "order": 4, "title": { "th": "คำนวณราคา", "en": "Calculate Price" }, "summary": { "th": "ใช้ Calculation/Tax Policy ที่มี Version และเก็บ Snapshot ก่อน–หลังปัด", "en": "Apply versioned calculation and tax policies with a reproducible rounding snapshot." }, "icon": "estimate", "phase": "phase-2", "status": "accepted", "document": "../01-business/estimation-calculation-rules.md" },
    { "id": "review", "group": "governance", "order": 5, "title": { "th": "ตรวจความพร้อมและส่ง", "en": "Validate and Submit" }, "summary": { "th": "บล็อกข้อมูลไม่ครบ แสดง Custom Work Item/Cost Exception และตรึง Approval Route ตอน Submit", "en": "Block incomplete data, surface custom work item and cost exceptions, and freeze the approval route on submit." }, "icon": "approval", "phase": "phase-2", "status": "accepted", "document": "../01-business/estimation-flow.md" },
    { "id": "approve", "group": "governance", "order": 6, "title": { "th": "ตรวจตามเส้นทางอนุมัติ", "en": "Review Approval Route" }, "summary": { "th": "ตรวจ Permission, Scope, Authority และ Maker–Checker ก่อน Approve หรือ Return", "en": "Check permission, scope, authority, and maker-checker before approval or return." }, "icon": "shield", "phase": "phase-2", "status": "accepted", "document": "../01-business/approval-matrix.md" },
    { "id": "quote", "group": "governance", "order": 7, "title": { "th": "ออกใบเสนอราคา", "en": "Issue Quotation" }, "summary": { "th": "สร้าง Customer-safe Snapshot จาก Approved Revision และไม่เผยต้นทุนภายใน", "en": "Create a customer-safe snapshot from an approved revision without exposing internal costs." }, "icon": "approval", "phase": "phase-2", "status": "accepted", "document": "../03-contracts/official-estimate-api-contract.md" }
  ],
  "edges": [
    { "from": "survey-ready", "to": "scope-work", "label": { "th": "เริ่มถอดงาน", "en": "Start takeoff" }, "type": "required" },
    { "from": "scope-work", "to": "cost", "label": { "th": "รายการครบ", "en": "Items ready" }, "type": "required" },
    { "from": "cost", "to": "price", "label": { "th": "ต้นทุนพร้อม", "en": "Costed" }, "type": "required" },
    { "from": "price", "to": "review", "label": { "th": "ได้ Snapshot ล่าสุด", "en": "Latest snapshot" }, "type": "required" },
    { "from": "review", "to": "approve", "label": { "th": "Submit และตรึง Route", "en": "Submit and freeze route" }, "type": "approval" },
    { "from": "approve", "to": "quote", "label": { "th": "อนุมัติแล้ว", "en": "Approved" }, "type": "approval" },
    { "from": "review", "to": "scope-work", "label": { "th": "ข้อมูลยังไม่พร้อม", "en": "Not ready" }, "type": "return" },
    { "from": "approve", "to": "scope-work", "label": { "th": "Return พร้อมเหตุผล", "en": "Return with reason" }, "type": "return" }
  ]
}
